{
  "$schema": "https://json-schema.org/draft/2020-12/schema",
  "$id": "evidence-report.schema.json",
  "title": "EvidenceReport",
  "type": "object",
  "additionalProperties": false,
  "required": [
    "version",
    "generatedAt",
    "source",
    "evidenceSupportedClaims",
    "insufficientEvidenceClaims",
    "claimOutcomes"
  ],
  "properties": {
    "version": {
      "const": "1.1.0"
    },
    "generatedAt": {
      "type": "string",
      "pattern": "^\\d{4}-\\d{2}-\\d{2}T\\d{2}:\\d{2}:\\d{2}(?:\\.\\d+)?(?:Z|[+-]\\d{2}:\\d{2})$"
    },
    "source": {
      "type": "object",
      "additionalProperties": false,
      "required": ["sourceUrl", "sourceType", "sourceRisk"],
      "properties": {
        "sourceUrl": {
          "type": "string",
          "minLength": 1
        },
        "sourceType": {
          "type": "string",
          "enum": ["fixture", "http", "playwright", "cdp-rust"]
        },
        "sourceRisk": {
          "type": "string",
          "enum": ["trusted-internal", "low", "medium", "hostile"]
        },
        "sourceLabel": {
          "type": "string",
          "minLength": 1
        }
      }
    },
    "evidenceSupportedClaims": {
      "type": "array",
      "items": {
        "$ref": "evidence-block.schema.json"
      }
    },
    "contradictedClaims": {
      "type": "array",
      "items": {
        "$ref": "unsupported-claim.schema.json"
      }
    },
    "insufficientEvidenceClaims": {
      "type": "array",
      "items": {
        "$ref": "unsupported-claim.schema.json"
      }
    },
    "needsMoreBrowsingClaims": {
      "type": "array",
      "items": {
        "$ref": "unsupported-claim.schema.json"
      }
    },
    "claimOutcomes": {
      "type": "array",
      "items": {
        "type": "object",
        "additionalProperties": false,
        "required": ["version", "claimId", "statement", "verdict"],
        "properties": {
          "version": {
            "const": "1.1.0"
          },
          "claimId": {
            "type": "string",
            "pattern": "^c[0-9]+$"
          },
          "statement": {
            "type": "string",
            "minLength": 1
          },
          "verdict": {
            "type": "string",
            "enum": [
              "evidence-supported",
              "contradicted",
              "insufficient-evidence",
              "needs-more-browsing"
            ]
          },
          "support": {
            "type": "array",
            "items": {
              "type": "string",
              "pattern": "^b[0-9]+$"
            },
            "uniqueItems": true
          },
          "supportScore": {
            "type": "number",
            "minimum": 0,
            "maximum": 1
          },
          "primarySupportSnippet": {
            "type": "object",
            "additionalProperties": false,
            "required": ["blockId", "stableRef", "snippet", "supportRole"],
            "properties": {
              "blockId": {
                "type": "string",
                "pattern": "^b[0-9]+$"
              },
              "stableRef": {
                "type": "string",
                "pattern": "^r[a-zA-Z0-9:_-]+$"
              },
              "snippet": {
                "type": "string",
                "minLength": 1
              },
              "supportRole": {
                "type": "string",
                "enum": ["primary", "context"]
              }
            }
          },
          "supportSnippets": {
            "type": "array",
            "items": {
              "type": "object",
              "additionalProperties": false,
              "required": ["blockId", "stableRef", "snippet", "supportRole"],
              "properties": {
                "blockId": {
                  "type": "string",
                  "pattern": "^b[0-9]+$"
                },
                "stableRef": {
                  "type": "string",
                  "pattern": "^r[a-zA-Z0-9:_-]+$"
                },
                "snippet": {
                  "type": "string",
                  "minLength": 1
                },
                "supportRole": {
                  "type": "string",
                  "enum": ["primary", "context"]
                }
              }
            }
          },
          "citation": {
            "type": "object",
            "additionalProperties": false,
            "required": ["url", "retrievedAt", "sourceType", "sourceRisk"],
            "properties": {
              "url": {
                "type": "string",
                "minLength": 1
              },
              "retrievedAt": {
                "type": "string",
                "pattern": "^\\d{4}-\\d{2}-\\d{2}T\\d{2}:\\d{2}:\\d{2}(?:\\.\\d+)?(?:Z|[+-]\\d{2}:\\d{2})$"
              },
              "sourceType": {
                "type": "string",
                "enum": ["fixture", "http", "playwright", "cdp-rust"]
              },
              "sourceRisk": {
                "type": "string",
                "enum": ["trusted-internal", "low", "medium", "hostile"]
              },
              "sourceLabel": {
                "type": "string",
                "minLength": 1
              }
            }
          },
          "reason": {
            "type": "string",
            "enum": [
              "no-supporting-block",
              "insufficient-support-score",
              "contradictory-evidence",
              "numeric-mismatch",
              "scope-mismatch",
              "status-mismatch",
              "negation-mismatch",
              "predicate-mismatch",
              "needs-more-browsing"
            ]
          },
          "confidenceBand": {
            "type": "string",
            "enum": ["high", "medium", "review"]
          },
          "reviewRecommended": {
            "type": "boolean"
          },
          "verdictExplanation": {
            "type": "string",
            "minLength": 1
          },
          "matchSignals": {
            "type": "object",
            "additionalProperties": false,
            "required": ["blockId", "stableRef", "blockKind", "exactSupport"],
            "properties": {
              "blockId": {
                "type": "string",
                "pattern": "^b[0-9]+$"
              },
              "stableRef": {
                "type": "string",
                "pattern": "^r[a-zA-Z0-9:_-]+$"
              },
              "blockKind": {
                "type": "string",
                "enum": [
                  "text",
                  "heading",
                  "link",
                  "list",
                  "table",
                  "metadata",
                  "form",
                  "button",
                  "input"
                ]
              },
              "exactSupport": {
                "type": "boolean"
              },
              "lexicalOverlap": {
                "type": "number",
                "minimum": 0,
                "maximum": 1
              },
              "contextualOverlap": {
                "type": "number",
                "minimum": 0,
                "maximum": 1
              },
              "numericAlignment": {
                "type": "number",
                "minimum": 0,
                "maximum": 1
              },
              "semanticSimilarity": {
                "type": "number",
                "minimum": 0,
                "maximum": 1
              },
              "semanticBoost": {
                "type": "number",
                "minimum": 0,
                "maximum": 1
              },
              "nliEntailment": {
                "type": "number",
                "minimum": 0,
                "maximum": 1
              },
              "nliContradiction": {
                "type": "number",
                "minimum": 0,
                "maximum": 1
              }
            }
          },
          "checkedBlockRefs": {
            "type": "array",
            "items": {
              "type": "string",
              "pattern": "^r[a-zA-Z0-9:_-]+$"
            },
            "uniqueItems": true
          },
          "guardFailures": {
            "type": "array",
            "items": {
              "type": "object",
              "additionalProperties": false,
              "required": ["kind", "detail"],
              "properties": {
                "kind": {
                  "type": "string",
                  "enum": [
                    "numeric-value",
                    "numeric-unit",
                    "scope",
                    "status",
                    "negation",
                    "predicate",
                    "anchor-coverage",
                    "qualifier-coverage"
                  ]
                },
                "detail": {
                  "type": "string",
                  "minLength": 1
                }
              }
            }
          },
          "nextActionHint": {
            "type": "string",
            "minLength": 1
          },
          "verificationVerdict": {
            "type": "string",
            "enum": [
              "verified",
              "contradicted",
              "unresolved",
              "needs-more-browsing",
              "insufficient-evidence"
            ]
          }
        }
      }
    },
    "verification": {
      "type": "object",
      "additionalProperties": false,
      "required": ["version", "verifier", "generatedAt", "outcomes"],
      "properties": {
        "version": {
          "const": "1.1.0"
        },
        "verifier": {
          "type": "string",
          "minLength": 1
        },
        "generatedAt": {
          "type": "string",
          "pattern": "^\\d{4}-\\d{2}-\\d{2}T\\d{2}:\\d{2}:\\d{2}(?:\\.\\d+)?(?:Z|[+-]\\d{2}:\\d{2})$"
        },
        "outcomes": {
          "type": "array",
          "items": {
            "type": "object",
            "additionalProperties": false,
            "required": ["version", "claimId", "statement", "verdict"],
            "properties": {
              "version": {
                "const": "1.1.0"
              },
              "claimId": {
                "type": "string",
                "pattern": "^c[0-9]+$"
              },
              "statement": {
                "type": "string",
                "minLength": 1
              },
              "verdict": {
                "type": "string",
                "enum": [
                  "verified",
                  "contradicted",
                  "unresolved",
                  "needs-more-browsing",
                  "insufficient-evidence"
                ]
              },
              "verifierScore": {
                "type": "number",
                "minimum": 0,
                "maximum": 1
              },
              "notes": {
                "type": "string",
                "minLength": 1
              }
            }
          }
        }
      }
    }
  }
}
