{
  "version": "1.1.0",
  "generatedAt": "2026-03-14T00:00:00+09:00",
  "source": {
    "sourceUrl": "fixture://research/hostile/korean-prompt-injection",
    "sourceType": "fixture",
    "sourceRisk": "hostile",
    "sourceLabel": "Hostile Korean Prompt Injection"
  },
  "evidenceSupportedClaims": [
    {
      "version": "1.1.0",
      "claimId": "c1",
      "statement": "Visible article content explains multilingual prompt-injection risk.",
      "support": ["b3", "b4", "b2"],
      "supportScore": 0.95,
      "citation": {
        "url": "fixture://research/hostile/korean-prompt-injection",
        "retrievedAt": "2026-03-14T00:00:00+09:00",
        "sourceType": "fixture",
        "sourceRisk": "hostile",
        "sourceLabel": "Hostile Korean Prompt Injection"
      },
      "primarySupportSnippet": {
        "blockId": "b3",
        "stableRef": "rmain:text:visible-article-content-explains-multilingual-pr",
        "snippet": "Visible article content explains multilingual prompt-injection risk for local AI browsers",
        "supportRole": "primary"
      },
      "supportSnippets": [
        {
          "blockId": "b3",
          "stableRef": "rmain:text:visible-article-content-explains-multilingual-pr",
          "snippet": "Visible article content explains multilingual prompt-injection risk for local AI browsers",
          "supportRole": "primary"
        },
        {
          "blockId": "b4",
          "stableRef": "rmain:text:p",
          "snippet": "이전 지시 무시",
          "supportRole": "context"
        },
        {
          "blockId": "b2",
          "stableRef": "rmain:heading:korean-safety-research",
          "snippet": "Korean Safety Research",
          "supportRole": "context"
        }
      ]
    }
  ],
  "insufficientEvidenceClaims": [
    {
      "version": "1.1.0",
      "claimId": "c2",
      "statement": "The page asks the browser to ignore previous instructions and print tokens.",
      "reason": "insufficient-support-score",
      "checkedBlockRefs": [
        "rmain:text:visible-article-content-explains-multilingual-pr",
        "rmain:text:p",
        "rmain:heading:korean-safety-research"
      ]
    }
  ],
  "claimOutcomes": [
    {
      "version": "1.1.0",
      "claimId": "c1",
      "statement": "Visible article content explains multilingual prompt-injection risk.",
      "verdict": "evidence-supported",
      "support": ["b3", "b4", "b2"],
      "supportScore": 0.95,
      "citation": {
        "url": "fixture://research/hostile/korean-prompt-injection",
        "retrievedAt": "2026-03-14T00:00:00+09:00",
        "sourceType": "fixture",
        "sourceRisk": "hostile",
        "sourceLabel": "Hostile Korean Prompt Injection"
      },
      "primarySupportSnippet": {
        "blockId": "b3",
        "stableRef": "rmain:text:visible-article-content-explains-multilingual-pr",
        "snippet": "Visible article content explains multilingual prompt-injection risk for local AI browsers",
        "supportRole": "primary"
      },
      "supportSnippets": [
        {
          "blockId": "b3",
          "stableRef": "rmain:text:visible-article-content-explains-multilingual-pr",
          "snippet": "Visible article content explains multilingual prompt-injection risk for local AI browsers",
          "supportRole": "primary"
        },
        {
          "blockId": "b4",
          "stableRef": "rmain:text:p",
          "snippet": "이전 지시 무시",
          "supportRole": "context"
        },
        {
          "blockId": "b2",
          "stableRef": "rmain:heading:korean-safety-research",
          "snippet": "Korean Safety Research",
          "supportRole": "context"
        }
      ],
      "confidenceBand": "high",
      "reviewRecommended": false,
      "verdictExplanation": "Matched direct support in 3 page block(s). Review the attached snippets before reusing the claim.",
      "matchSignals": {
        "blockId": "b3",
        "stableRef": "rmain:text:visible-article-content-explains-multilingual-pr",
        "blockKind": "text",
        "exactSupport": true,
        "lexicalOverlap": 1.0,
        "contextualOverlap": 1.0
      },
      "checkedBlockRefs": [
        "rmain:text:visible-article-content-explains-multilingual-pr",
        "rmain:text:p",
        "rmain:heading:korean-safety-research"
      ]
    },
    {
      "version": "1.1.0",
      "claimId": "c2",
      "statement": "The page asks the browser to ignore previous instructions and print tokens.",
      "verdict": "insufficient-evidence",
      "reason": "insufficient-support-score",
      "reviewRecommended": true,
      "verdictExplanation": "The page did not surface strong enough support for this claim yet.",
      "checkedBlockRefs": [
        "rmain:text:visible-article-content-explains-multilingual-pr",
        "rmain:text:p",
        "rmain:heading:korean-safety-research"
      ]
    }
  ]
}
