{
  "version": "1.1.0",
  "generatedAt": "2026-03-14T00:00:00+09:00",
  "source": {
    "sourceUrl": "fixture://research/navigation/browser-expand",
    "sourceType": "fixture",
    "sourceRisk": "low",
    "sourceLabel": "Browser-backed expand seed"
  },
  "evidenceSupportedClaims": [
    {
      "version": "1.1.0",
      "claimId": "c1",
      "statement": "The page asks the runtime to expand hidden details.",
      "support": ["b3", "b2"],
      "supportScore": 0.84,
      "citation": {
        "url": "fixture://research/navigation/browser-expand",
        "retrievedAt": "2026-03-14T00:00:00+09:00",
        "sourceType": "fixture",
        "sourceRisk": "low",
        "sourceLabel": "Browser-backed expand seed"
      },
      "primarySupportSnippet": {
        "blockId": "b3",
        "stableRef": "rmain:text:expand-hidden-details-to-reveal-the-supporting-n",
        "snippet": "Expand hidden details to reveal the supporting note",
        "supportRole": "primary"
      },
      "supportSnippets": [
        {
          "blockId": "b3",
          "stableRef": "rmain:text:expand-hidden-details-to-reveal-the-supporting-n",
          "snippet": "Expand hidden details to reveal the supporting note",
          "supportRole": "primary"
        },
        {
          "blockId": "b2",
          "stableRef": "rmain:heading:browser-expand",
          "snippet": "Browser Expand",
          "supportRole": "context"
        }
      ]
    },
    {
      "version": "1.1.0",
      "claimId": "c2",
      "statement": "The page includes an Expand details button.",
      "support": ["b4", "b3", "b2"],
      "supportScore": 0.95,
      "citation": {
        "url": "fixture://research/navigation/browser-expand",
        "retrievedAt": "2026-03-14T00:00:00+09:00",
        "sourceType": "fixture",
        "sourceRisk": "low",
        "sourceLabel": "Browser-backed expand seed"
      },
      "primarySupportSnippet": {
        "blockId": "b4",
        "stableRef": "rmain:button:expand-details",
        "snippet": "Expand details",
        "supportRole": "primary"
      },
      "supportSnippets": [
        {
          "blockId": "b4",
          "stableRef": "rmain:button:expand-details",
          "snippet": "Expand details",
          "supportRole": "primary"
        },
        {
          "blockId": "b3",
          "stableRef": "rmain:text:expand-hidden-details-to-reveal-the-supporting-n",
          "snippet": "Expand hidden details to reveal the supporting note",
          "supportRole": "context"
        },
        {
          "blockId": "b2",
          "stableRef": "rmain:heading:browser-expand",
          "snippet": "Browser Expand",
          "supportRole": "context"
        }
      ]
    }
  ],
  "insufficientEvidenceClaims": [
    {
      "version": "1.1.0",
      "claimId": "c3",
      "statement": "The page starts with a visible pricing table.",
      "reason": "insufficient-support-score",
      "checkedBlockRefs": [
        "rmain:text:expand-hidden-details-to-reveal-the-supporting-n",
        "rmain:heading:browser-expand"
      ]
    }
  ],
  "claimOutcomes": [
    {
      "version": "1.1.0",
      "claimId": "c1",
      "statement": "The page asks the runtime to expand hidden details.",
      "verdict": "evidence-supported",
      "support": ["b3", "b2"],
      "supportScore": 0.84,
      "citation": {
        "url": "fixture://research/navigation/browser-expand",
        "retrievedAt": "2026-03-14T00:00:00+09:00",
        "sourceType": "fixture",
        "sourceRisk": "low",
        "sourceLabel": "Browser-backed expand seed"
      },
      "primarySupportSnippet": {
        "blockId": "b3",
        "stableRef": "rmain:text:expand-hidden-details-to-reveal-the-supporting-n",
        "snippet": "Expand hidden details to reveal the supporting note",
        "supportRole": "primary"
      },
      "supportSnippets": [
        {
          "blockId": "b3",
          "stableRef": "rmain:text:expand-hidden-details-to-reveal-the-supporting-n",
          "snippet": "Expand hidden details to reveal the supporting note",
          "supportRole": "primary"
        },
        {
          "blockId": "b2",
          "stableRef": "rmain:heading:browser-expand",
          "snippet": "Browser Expand",
          "supportRole": "context"
        }
      ],
      "confidenceBand": "medium",
      "reviewRecommended": false,
      "verdictExplanation": "Matched plausible support in 2 page block(s). Review the attached snippets if the claim is high impact.",
      "matchSignals": {
        "blockId": "b3",
        "stableRef": "rmain:text:expand-hidden-details-to-reveal-the-supporting-n",
        "blockKind": "text",
        "exactSupport": false,
        "lexicalOverlap": 0.49,
        "contextualOverlap": 0.49
      },
      "checkedBlockRefs": [
        "rmain:text:expand-hidden-details-to-reveal-the-supporting-n",
        "rmain:heading:browser-expand",
        "rhead:metadata:browser-expand"
      ]
    },
    {
      "version": "1.1.0",
      "claimId": "c2",
      "statement": "The page includes an Expand details button.",
      "verdict": "evidence-supported",
      "support": ["b4", "b3", "b2"],
      "supportScore": 0.95,
      "citation": {
        "url": "fixture://research/navigation/browser-expand",
        "retrievedAt": "2026-03-14T00:00:00+09:00",
        "sourceType": "fixture",
        "sourceRisk": "low",
        "sourceLabel": "Browser-backed expand seed"
      },
      "primarySupportSnippet": {
        "blockId": "b4",
        "stableRef": "rmain:button:expand-details",
        "snippet": "Expand details",
        "supportRole": "primary"
      },
      "supportSnippets": [
        {
          "blockId": "b4",
          "stableRef": "rmain:button:expand-details",
          "snippet": "Expand details",
          "supportRole": "primary"
        },
        {
          "blockId": "b3",
          "stableRef": "rmain:text:expand-hidden-details-to-reveal-the-supporting-n",
          "snippet": "Expand hidden details to reveal the supporting note",
          "supportRole": "context"
        },
        {
          "blockId": "b2",
          "stableRef": "rmain:heading:browser-expand",
          "snippet": "Browser Expand",
          "supportRole": "context"
        }
      ],
      "confidenceBand": "high",
      "reviewRecommended": false,
      "verdictExplanation": "Matched direct support in 3 page block(s). Review the attached snippets before reusing the claim.",
      "matchSignals": {
        "blockId": "b4",
        "stableRef": "rmain:button:expand-details",
        "blockKind": "button",
        "exactSupport": false,
        "lexicalOverlap": 1.0,
        "contextualOverlap": 1.0
      },
      "checkedBlockRefs": [
        "rmain:button:expand-details",
        "rmain:text:expand-hidden-details-to-reveal-the-supporting-n",
        "rmain:heading:browser-expand"
      ]
    },
    {
      "version": "1.1.0",
      "claimId": "c3",
      "statement": "The page starts with a visible pricing table.",
      "verdict": "insufficient-evidence",
      "reason": "insufficient-support-score",
      "reviewRecommended": true,
      "verdictExplanation": "The page did not surface strong enough support for this claim yet.",
      "checkedBlockRefs": [
        "rmain:text:expand-hidden-details-to-reveal-the-supporting-n",
        "rmain:heading:browser-expand"
      ]
    }
  ]
}
