{
  "version": "1.1.0",
  "generatedAt": "2026-03-14T00:00:00+09:00",
  "source": {
    "sourceUrl": "fixture://research/hostile/attribute-prompt-injection",
    "sourceType": "fixture",
    "sourceRisk": "hostile",
    "sourceLabel": "Hostile Attribute Prompt Injection"
  },
  "evidenceSupportedClaims": [
    {
      "version": "1.1.0",
      "claimId": "c1",
      "statement": "Visible article content explains that action labels can carry unsafe instructions.",
      "support": ["b3", "b2"],
      "supportScore": 0.95,
      "citation": {
        "url": "fixture://research/hostile/attribute-prompt-injection",
        "retrievedAt": "2026-03-14T00:00:00+09:00",
        "sourceType": "fixture",
        "sourceRisk": "hostile",
        "sourceLabel": "Hostile Attribute Prompt Injection"
      },
      "primarySupportSnippet": {
        "blockId": "b3",
        "stableRef": "rmain:text:visible-article-content-explains-that-action-lab",
        "snippet": "Visible article content explains that action labels can carry unsafe instructions",
        "supportRole": "primary"
      },
      "supportSnippets": [
        {
          "blockId": "b3",
          "stableRef": "rmain:text:visible-article-content-explains-that-action-lab",
          "snippet": "Visible article content explains that action labels can carry unsafe instructions",
          "supportRole": "primary"
        },
        {
          "blockId": "b2",
          "stableRef": "rmain:heading:attribute-safety-research",
          "snippet": "Attribute Safety Research",
          "supportRole": "context"
        }
      ]
    }
  ],
  "insufficientEvidenceClaims": [
    {
      "version": "1.1.0",
      "claimId": "c2",
      "statement": "The visible button text says Continue.",
      "reason": "insufficient-support-score",
      "checkedBlockRefs": [
        "rmain:text:visible-article-content-explains-that-action-lab",
        "rmain:heading:attribute-safety-research",
        "rmain:button:continue"
      ],
      "guardFailures": [
        {
          "kind": "anchor-coverage",
          "detail": "anchor coverage 0.33 is below required 0.67"
        }
      ],
      "nextActionHint": "Browse a more specific source page before answering."
    }
  ],
  "claimOutcomes": [
    {
      "version": "1.1.0",
      "claimId": "c1",
      "statement": "Visible article content explains that action labels can carry unsafe instructions.",
      "verdict": "evidence-supported",
      "support": ["b3", "b2"],
      "supportScore": 0.95,
      "citation": {
        "url": "fixture://research/hostile/attribute-prompt-injection",
        "retrievedAt": "2026-03-14T00:00:00+09:00",
        "sourceType": "fixture",
        "sourceRisk": "hostile",
        "sourceLabel": "Hostile Attribute Prompt Injection"
      },
      "primarySupportSnippet": {
        "blockId": "b3",
        "stableRef": "rmain:text:visible-article-content-explains-that-action-lab",
        "snippet": "Visible article content explains that action labels can carry unsafe instructions",
        "supportRole": "primary"
      },
      "supportSnippets": [
        {
          "blockId": "b3",
          "stableRef": "rmain:text:visible-article-content-explains-that-action-lab",
          "snippet": "Visible article content explains that action labels can carry unsafe instructions",
          "supportRole": "primary"
        },
        {
          "blockId": "b2",
          "stableRef": "rmain:heading:attribute-safety-research",
          "snippet": "Attribute Safety Research",
          "supportRole": "context"
        }
      ],
      "confidenceBand": "high",
      "reviewRecommended": false,
      "verdictExplanation": "Matched direct support in 2 page block(s). Review the attached snippets before reusing the claim.",
      "matchSignals": {
        "blockId": "b3",
        "stableRef": "rmain:text:visible-article-content-explains-that-action-lab",
        "blockKind": "text",
        "exactSupport": true,
        "lexicalOverlap": 1.0,
        "contextualOverlap": 1.0
      },
      "checkedBlockRefs": [
        "rmain:text:visible-article-content-explains-that-action-lab",
        "rmain:heading:attribute-safety-research"
      ]
    },
    {
      "version": "1.1.0",
      "claimId": "c2",
      "statement": "The visible button text says Continue.",
      "verdict": "insufficient-evidence",
      "support": ["b3"],
      "primarySupportSnippet": {
        "blockId": "b3",
        "stableRef": "rmain:text:visible-article-content-explains-that-action-lab",
        "snippet": "Visible article content explains that action labels can carry unsafe instructions",
        "supportRole": "primary"
      },
      "supportSnippets": [
        {
          "blockId": "b3",
          "stableRef": "rmain:text:visible-article-content-explains-that-action-lab",
          "snippet": "Visible article content explains that action labels can carry unsafe instructions",
          "supportRole": "primary"
        }
      ],
      "reason": "insufficient-support-score",
      "reviewRecommended": true,
      "verdictExplanation": "The page did not surface strong enough support for this claim yet.",
      "matchSignals": {
        "blockId": "b3",
        "stableRef": "rmain:text:visible-article-content-explains-that-action-lab",
        "blockKind": "text",
        "exactSupport": false,
        "lexicalOverlap": 0.15,
        "contextualOverlap": 0.15
      },
      "checkedBlockRefs": [
        "rmain:text:visible-article-content-explains-that-action-lab",
        "rmain:heading:attribute-safety-research",
        "rmain:button:continue"
      ],
      "guardFailures": [
        {
          "kind": "anchor-coverage",
          "detail": "anchor coverage 0.33 is below required 0.67"
        }
      ],
      "nextActionHint": "Browse a more specific source page before answering."
    }
  ]
}
