{
  "version": "1.1.0",
  "generatedAt": "2026-03-14T00:00:00+09:00",
  "source": {
    "sourceUrl": "fixture://research/navigation/browser-mfa-challenge",
    "sourceType": "fixture",
    "sourceRisk": "low",
    "sourceLabel": "Browser MFA challenge seed"
  },
  "evidenceSupportedClaims": [
    {
      "version": "1.1.0",
      "claimId": "c1",
      "statement": "The page asks for a verification code.",
      "support": ["b3", "b7", "b2"],
      "supportScore": 0.77,
      "citation": {
        "url": "fixture://research/navigation/browser-mfa-challenge",
        "retrievedAt": "2026-03-14T00:00:00+09:00",
        "sourceType": "fixture",
        "sourceRisk": "low",
        "sourceLabel": "Browser MFA challenge seed"
      },
      "primarySupportSnippet": {
        "blockId": "b3",
        "stableRef": "rmain:text:enter-the-6-digit-verification-code-from-your-au",
        "snippet": "Enter the 6-digit verification code from your authenticator app",
        "supportRole": "primary"
      },
      "supportSnippets": [
        {
          "blockId": "b3",
          "stableRef": "rmain:text:enter-the-6-digit-verification-code-from-your-au",
          "snippet": "Enter the 6-digit verification code from your authenticator app",
          "supportRole": "primary"
        },
        {
          "blockId": "b7",
          "stableRef": "rmain:text:status",
          "snippet": "Waiting for verification code",
          "supportRole": "context"
        },
        {
          "blockId": "b2",
          "stableRef": "rmain:heading:two-factor-verification",
          "snippet": "Two-factor verification",
          "supportRole": "context"
        }
      ]
    }
  ],
  "insufficientEvidenceClaims": [
    {
      "version": "1.1.0",
      "claimId": "c2",
      "statement": "The page already shows a signed-in dashboard.",
      "reason": "insufficient-support-score",
      "checkedBlockRefs": [
        "rmain:text:enter-the-6-digit-verification-code-from-your-au",
        "rmain:text:status",
        "rmain:heading:two-factor-verification"
      ]
    }
  ],
  "claimOutcomes": [
    {
      "version": "1.1.0",
      "claimId": "c1",
      "statement": "The page asks for a verification code.",
      "verdict": "evidence-supported",
      "support": ["b3", "b7", "b2"],
      "supportScore": 0.77,
      "citation": {
        "url": "fixture://research/navigation/browser-mfa-challenge",
        "retrievedAt": "2026-03-14T00:00:00+09:00",
        "sourceType": "fixture",
        "sourceRisk": "low",
        "sourceLabel": "Browser MFA challenge seed"
      },
      "primarySupportSnippet": {
        "blockId": "b3",
        "stableRef": "rmain:text:enter-the-6-digit-verification-code-from-your-au",
        "snippet": "Enter the 6-digit verification code from your authenticator app",
        "supportRole": "primary"
      },
      "supportSnippets": [
        {
          "blockId": "b3",
          "stableRef": "rmain:text:enter-the-6-digit-verification-code-from-your-au",
          "snippet": "Enter the 6-digit verification code from your authenticator app",
          "supportRole": "primary"
        },
        {
          "blockId": "b7",
          "stableRef": "rmain:text:status",
          "snippet": "Waiting for verification code",
          "supportRole": "context"
        },
        {
          "blockId": "b2",
          "stableRef": "rmain:heading:two-factor-verification",
          "snippet": "Two-factor verification",
          "supportRole": "context"
        }
      ],
      "confidenceBand": "review",
      "reviewRecommended": true,
      "verdictExplanation": "Support is present but still borderline across 3 page block(s). Review the attached snippets before reusing the claim.",
      "matchSignals": {
        "blockId": "b3",
        "stableRef": "rmain:text:enter-the-6-digit-verification-code-from-your-au",
        "blockKind": "text",
        "exactSupport": false,
        "lexicalOverlap": 0.29,
        "contextualOverlap": 0.29
      },
      "checkedBlockRefs": [
        "rmain:text:enter-the-6-digit-verification-code-from-your-au",
        "rmain:text:status",
        "rmain:heading:two-factor-verification"
      ]
    },
    {
      "version": "1.1.0",
      "claimId": "c2",
      "statement": "The page already shows a signed-in dashboard.",
      "verdict": "insufficient-evidence",
      "reason": "insufficient-support-score",
      "reviewRecommended": true,
      "verdictExplanation": "The page did not surface strong enough support for this claim yet.",
      "checkedBlockRefs": [
        "rmain:text:enter-the-6-digit-verification-code-from-your-au",
        "rmain:text:status",
        "rmain:heading:two-factor-verification"
      ]
    }
  ]
}
