{
  "version": "1.1.0",
  "generatedAt": "2026-03-14T00:00:00+09:00",
  "source": {
    "sourceUrl": "fixture://research/navigation/browser-captcha-checkpoint",
    "sourceType": "fixture",
    "sourceRisk": "low",
    "sourceLabel": "Browser CAPTCHA checkpoint seed"
  },
  "evidenceSupportedClaims": [
    {
      "version": "1.1.0",
      "claimId": "c1",
      "statement": "Verify you are human before continuing to the research workspace.",
      "support": ["b3", "b2"],
      "supportScore": 0.95,
      "citation": {
        "url": "fixture://research/navigation/browser-captcha-checkpoint",
        "retrievedAt": "2026-03-14T00:00:00+09:00",
        "sourceType": "fixture",
        "sourceRisk": "low",
        "sourceLabel": "Browser CAPTCHA checkpoint seed"
      },
      "primarySupportSnippet": {
        "blockId": "b3",
        "stableRef": "rmain:text:verify-you-are-human-before-continuing-to-the-re",
        "snippet": "Verify you are human before continuing to the research workspace",
        "supportRole": "primary"
      },
      "supportSnippets": [
        {
          "blockId": "b3",
          "stableRef": "rmain:text:verify-you-are-human-before-continuing-to-the-re",
          "snippet": "Verify you are human before continuing to the research workspace",
          "supportRole": "primary"
        },
        {
          "blockId": "b2",
          "stableRef": "rmain:heading:security-checkpoint",
          "snippet": "Security checkpoint",
          "supportRole": "context"
        }
      ]
    }
  ],
  "insufficientEvidenceClaims": [
    {
      "version": "1.1.0",
      "claimId": "c2",
      "statement": "The page already grants access to the workspace.",
      "reason": "insufficient-support-score",
      "checkedBlockRefs": [
        "rmain:text:verify-you-are-human-before-continuing-to-the-re",
        "rmain:heading:security-checkpoint",
        "rmain:text:status"
      ],
      "guardFailures": [
        {
          "kind": "anchor-coverage",
          "detail": "anchor coverage 0.25 is below required 0.60"
        }
      ],
      "nextActionHint": "Browse a more specific source page before answering."
    }
  ],
  "claimOutcomes": [
    {
      "version": "1.1.0",
      "claimId": "c1",
      "statement": "Verify you are human before continuing to the research workspace.",
      "verdict": "evidence-supported",
      "support": ["b3", "b2"],
      "supportScore": 0.95,
      "citation": {
        "url": "fixture://research/navigation/browser-captcha-checkpoint",
        "retrievedAt": "2026-03-14T00:00:00+09:00",
        "sourceType": "fixture",
        "sourceRisk": "low",
        "sourceLabel": "Browser CAPTCHA checkpoint seed"
      },
      "primarySupportSnippet": {
        "blockId": "b3",
        "stableRef": "rmain:text:verify-you-are-human-before-continuing-to-the-re",
        "snippet": "Verify you are human before continuing to the research workspace",
        "supportRole": "primary"
      },
      "supportSnippets": [
        {
          "blockId": "b3",
          "stableRef": "rmain:text:verify-you-are-human-before-continuing-to-the-re",
          "snippet": "Verify you are human before continuing to the research workspace",
          "supportRole": "primary"
        },
        {
          "blockId": "b2",
          "stableRef": "rmain:heading:security-checkpoint",
          "snippet": "Security checkpoint",
          "supportRole": "context"
        }
      ],
      "confidenceBand": "high",
      "reviewRecommended": false,
      "verdictExplanation": "Matched direct support in 2 page block(s). Review the attached snippets before reusing the claim.",
      "matchSignals": {
        "blockId": "b3",
        "stableRef": "rmain:text:verify-you-are-human-before-continuing-to-the-re",
        "blockKind": "text",
        "exactSupport": true,
        "lexicalOverlap": 1.0,
        "contextualOverlap": 1.0
      },
      "checkedBlockRefs": [
        "rmain:text:verify-you-are-human-before-continuing-to-the-re",
        "rmain:heading:security-checkpoint",
        "rmain:text:status"
      ]
    },
    {
      "version": "1.1.0",
      "claimId": "c2",
      "statement": "The page already grants access to the workspace.",
      "verdict": "insufficient-evidence",
      "support": ["b3"],
      "primarySupportSnippet": {
        "blockId": "b3",
        "stableRef": "rmain:text:verify-you-are-human-before-continuing-to-the-re",
        "snippet": "Verify you are human before continuing to the research workspace",
        "supportRole": "primary"
      },
      "supportSnippets": [
        {
          "blockId": "b3",
          "stableRef": "rmain:text:verify-you-are-human-before-continuing-to-the-re",
          "snippet": "Verify you are human before continuing to the research workspace",
          "supportRole": "primary"
        }
      ],
      "reason": "insufficient-support-score",
      "reviewRecommended": true,
      "verdictExplanation": "The page did not surface strong enough support for this claim yet.",
      "matchSignals": {
        "blockId": "b3",
        "stableRef": "rmain:text:verify-you-are-human-before-continuing-to-the-re",
        "blockKind": "text",
        "exactSupport": false,
        "lexicalOverlap": 0.18,
        "contextualOverlap": 0.18
      },
      "checkedBlockRefs": [
        "rmain:text:verify-you-are-human-before-continuing-to-the-re",
        "rmain:heading:security-checkpoint",
        "rmain:text:status"
      ],
      "guardFailures": [
        {
          "kind": "anchor-coverage",
          "detail": "anchor coverage 0.25 is below required 0.60"
        }
      ],
      "nextActionHint": "Browse a more specific source page before answering."
    }
  ]
}
